{
  "$schema": "./schema/timeline.schema.json",
  "updated": "2026-09-14",
  "sourceNote": {
    "th": "เรียบเรียงจากสไลด์ \"ประวัติศาสตร์ HPC ในประเทศไทย\" (10 หน้า) ปี พ.ศ. ในต้นฉบับบางจุดคลาดเคลื่อน เว็บไซต์นี้คำนวณ พ.ศ. = ค.ศ. + 543",
    "en": "Compiled from the 10-page \"History of HPC in Thailand\" slide deck. A few Buddhist-era years in the original are typos; this site computes BE = CE + 543."
  },
  "eras": [
    {
      "id": "origins",
      "from": 1963,
      "to": 1979,
      "label": { "th": "ยุคบุกเบิก", "en": "Origins" },
      "tagline": { "th": "คอมพิวเตอร์เครื่องแรกของประเทศไทย", "en": "Thailand's first computer" }
    },
    {
      "id": "gen1",
      "from": 1980,
      "to": 1999,
      "label": { "th": "ยุคที่ 1", "en": "1st Generation" },
      "tagline": { "th": "กำเนิดยุคแห่งงานวิจัยด้าน Computer Science", "en": "The dawn of HPC" }
    },
    {
      "id": "gen2",
      "from": 2000,
      "to": 2010,
      "label": { "th": "ยุคที่ 2", "en": "2nd Generation" },
      "tagline": { "th": "ระบบกริดถือกำเนิดขึ้น", "en": "Grid Computing" }
    },
    {
      "id": "gen3",
      "from": 2011,
      "to": 2018,
      "label": { "th": "ยุคที่ 3", "en": "3rd Generation" },
      "tagline": { "th": "UniNet2 และ National e-Science Infrastructure Consortium", "en": "UniNet2 and the National e-Science Infrastructure Consortium" }
    },
    {
      "id": "gen4",
      "from": 2019,
      "to": 2030,
      "label": { "th": "ยุคที่ 4", "en": "4th Generation" },
      "tagline": { "th": "ยุคแห่ง Supercomputer และ AI-HPC", "en": "Supercomputers and AI-HPC" }
    }
  ],
  "entries": [
    {
      "id": "1963-ibm-1620",
      "year": 1963,
      "era": "origins",
      "kind": "milestone",
      "category": "system",
      "title": {
        "th": "คอมพิวเตอร์เครื่องแรกในประเทศไทย",
        "en": "The first computer in Thailand"
      },
      "subtitle": { "th": "IBM 1620", "en": "IBM 1620" },
      "org": {
        "th": "อาคารศูนย์คำนวณสถิติ (ตึก 9) ภาควิชาสถิติ คณะพาณิชยศาสตร์และการบัญชี จุฬาลงกรณ์มหาวิทยาลัย",
        "en": "Statistical Computing Centre (Building 9), Department of Statistics, Faculty of Commerce and Accountancy, Chulalongkorn University"
      },
      "tags": ["IBM", "CU"],
      "source": "p1"
    },
    {
      "id": "1980-gen1",
      "year": 1980,
      "era": "gen1",
      "kind": "era",
      "category": "era",
      "title": {
        "th": "กำเนิดยุคแห่งงานวิจัยด้าน Computer Science",
        "en": "The birth of computer science research in Thailand"
      },
      "subtitle": {
        "th": "First Generation: The dawn of HPC",
        "en": "First Generation: The dawn of HPC"
      },
      "source": "p1"
    },
    {
      "id": "1986-thai-internet",
      "year": 1986,
      "era": "gen1",
      "kind": "milestone",
      "category": "network",
      "title": { "th": "กำเนิดอินเทอร์เน็ตไทย", "en": "The birth of the Thai Internet" },
      "org": {
        "th": "intERLab, AIT",
        "en": "intERLab, AIT"
      },
      "body": {
        "th": "ถือกำเนิดโดย ศ.ดร.กาญจนา กาญจนสุต — โครงข่ายเชื่อมต่อจาก AIT ไปยัง Melbourne",
        "en": "Pioneered by Prof. Dr. Kanchana Kanchanasut — the first link from AIT to Melbourne."
      },
      "tags": ["AIT", "Network"],
      "source": "p1"
    },
    {
      "id": "1991-hpcc-nectec",
      "year": 1991,
      "era": "gen1",
      "kind": "milestone",
      "category": "org",
      "title": {
        "th": "ศูนย์ High Performance Computing Center (HPCC)",
        "en": "High Performance Computing Center (HPCC)"
      },
      "org": {
        "th": "โดย National Electronics and Computer Technology Center (NECTEC), NSTDA",
        "en": "By the National Electronics and Computer Technology Center (NECTEC), NSTDA"
      },
      "tags": ["NECTEC", "NSTDA"],
      "link": "https://www.nectec.or.th/",
      "source": "p1"
    },
    {
      "id": "1992-thaisarn",
      "year": 1992,
      "era": "gen1",
      "kind": "milestone",
      "category": "network",
      "title": { "th": "ประเทศไทยออกสู่อินเทอร์เน็ต", "en": "Thailand connects to the global Internet" },
      "body": {
        "th": "กำเนิดเครือข่ายวิจัยของสถาบัน ไทยสาร-1 (ThaiSarn 1) — AIT, CU, PSU, KU, NECTEC",
        "en": "ThaiSarn 1, the first inter-institutional research network — AIT, CU, PSU, KU, NECTEC."
      },
      "tags": ["ThaiSarn", "NECTEC", "Network"],
      "source": "p1"
    },
    {
      "id": "1994-cray-el98",
      "year": 1994,
      "era": "gen1",
      "kind": "highlight",
      "category": "system",
      "title": {
        "th": "Supercomputer เครื่องแรกของประเทศไทย",
        "en": "Thailand's first supercomputer"
      },
      "subtitle": { "th": "CRAY EL98", "en": "CRAY EL98" },
      "org": { "th": "HPCC, NECTEC, NSTDA", "en": "HPCC, NECTEC, NSTDA" },
      "stats": [
        { "label": { "th": "โปรเซสเซอร์", "en": "Processors" }, "value": "8" },
        { "label": { "th": "หน่วยความจำ", "en": "Memory" }, "value": "2 GB DRAM" }
      ],
      "tags": ["CRAY", "NECTEC", "NSTDA"],
      "source": "p1"
    },
    {
      "id": "1995-beowulf",
      "year": 1995,
      "era": "gen1",
      "kind": "milestone",
      "category": "system",
      "title": {
        "th": "สถาบันวิจัยและมหาวิทยาลัยเริ่มจัดซื้อและติดตั้งระบบคอมพิวเตอร์สมรรถนะสูง",
        "en": "Research institutes and universities begin procuring HPC systems"
      },
      "subtitle": {
        "th": "แนวคิดของ BEOWULF cluster กำเนิดขึ้น",
        "en": "The BEOWULF cluster concept emerges"
      },
      "org": { "th": "KU | KMUTT | KMITL | TMD", "en": "KU | KMUTT | KMITL | TMD" },
      "body": {
        "th": "มีระบบที่หลากหลาย IBM SP2 / IBM RS600 / SUN SPARC / HP (Convex) / DEC Alpha",
        "en": "A diverse mix of systems: IBM SP2 / IBM RS600 / SUN SPARC / HP (Convex) / DEC Alpha."
      },
      "tags": ["Beowulf", "KU", "KMUTT", "KMITL", "TMD"],
      "source": "p2"
    },
    {
      "id": "1997-csea-unofficial",
      "year": 1997,
      "era": "gen1",
      "kind": "milestone",
      "category": "org",
      "title": {
        "th": "Computational Science and Engineering Association (CSEA) — ไม่เป็นทางการ",
        "en": "Computational Science and Engineering Association (CSEA) — unofficial"
      },
      "body": {
        "th": "นักวิจัย นักวิทยาศาสตร์ วิศวกรและนักวิทยาการคอมพิวเตอร์ รวมตัวกันเป็นสมาคมวิทยาการและวิศวกรรมเชิงคอมพิวเตอร์",
        "en": "Researchers, scientists, engineers and computer scientists come together as an informal computational science and engineering community."
      },
      "tags": ["CSEA", "Community"],
      "source": "p2"
    },
    {
      "id": "1997-smile",
      "year": 1997,
      "era": "gen1",
      "kind": "milestone",
      "category": "software",
      "title": { "th": "เริ่มโครงการ SMILE", "en": "SMILE project started" },
      "body": {
        "th": "โดย อ.ปุจฉง อุทัยโยภาส (Aj. Putchong Uthayopas) และ อ.สุรศักดิ์ สงวนพงษ์ (Aj. Surasak Sanguanpong)",
        "en": "By Aj. Putchong Uthayopas and Aj. Surasak Sanguanpong."
      },
      "tags": ["SMILE", "KU", "Open Source"],
      "source": "p2"
    },
    {
      "id": "1999-pirun",
      "year": 1999,
      "era": "gen1",
      "kind": "highlight",
      "category": "system",
      "title": { "th": "The PIRUN Cluster", "en": "The PIRUN Cluster" },
      "subtitle": {
        "th": "PIRUN — Pile of Inexpensive and Redundant Universal Nodes",
        "en": "PIRUN — Pile of Inexpensive and Redundant Universal Nodes"
      },
      "org": { "th": "มหาวิทยาลัยเกษตรศาสตร์ (KU)", "en": "Kasetsart University (KU)" },
      "body": {
        "th": "ซูเปอร์คอมพิวเตอร์ที่เร็วที่สุดในประเทศไทยในขณะนั้น พร้อมชุดเครื่องมือ SMILE Cluster Management System (SCMS) และ SQMS toolkit",
        "en": "The fastest supercomputer in Thailand at the time, together with the SMILE Cluster Management System (SCMS) and SQMS toolkits."
      },
      "badges": [{ "th": "เร็วที่สุดในไทย", "en": "Fastest in Thailand" }],
      "tags": ["PIRUN", "KU", "Beowulf"],
      "source": "p2"
    },
    {
      "id": "2000-gen2",
      "year": 2000,
      "era": "gen2",
      "kind": "era",
      "category": "era",
      "title": { "th": "ระบบกริดถือกำเนิดขึ้น", "en": "The grid arrives" },
      "subtitle": {
        "th": "Second Generation: Grid Computing",
        "en": "Second Generation: Grid Computing"
      },
      "source": "p2"
    },
    {
      "id": "2001-thaigrid",
      "year": 2001,
      "era": "gen2",
      "kind": "milestone",
      "category": "org",
      "title": {
        "th": "จุดเริ่มต้นของ ThaiGrid project (TNGP)",
        "en": "The ThaiGrid project (TNGP) begins"
      },
      "body": {
        "th": "ระบบกริดแรกที่เชื่อมต่อระหว่าง KU กับ KMUTNB ต่อมามีสมาชิกเพิ่มเติมคือ AIT, CU, KU, KMUTNB, KMUTT, KMITL, SUT, TMD, CMU, KKU, WU และ PSU",
        "en": "The first grid linking KU and KMUTNB, later joined by AIT, CU, KU, KMUTNB, KMUTT, KMITL, SUT, TMD, CMU, KKU, WU and PSU."
      },
      "tags": ["ThaiGrid", "TNGP", "Grid"],
      "source": "p2"
    },
    {
      "id": "2003-thai-escience",
      "year": 2003,
      "era": "gen2",
      "kind": "milestone",
      "category": "org",
      "title": { "th": "เริ่มต้น Thai e-Science Project", "en": "The Thai e-Science Project begins" },
      "bullets": [
        {
          "th": "Computational Chemistry, Department of Chemistry, CU",
          "en": "Computational Chemistry, Department of Chemistry, CU"
        },
        {
          "th": "Department of Computer Engineering, CU",
          "en": "Department of Computer Engineering, CU"
        },
        { "th": "HPCNC, KU", "en": "HPCNC, KU" }
      ],
      "tags": ["e-Science", "CU", "KU"],
      "source": "p3"
    },
    {
      "id": "2006-tngc",
      "year": 2006,
      "era": "gen2",
      "kind": "highlight",
      "category": "org",
      "title": { "th": "Thai National Grid Center (TNGC)", "en": "Thai National Grid Center (TNGC)" },
      "body": {